{
  "schema_version": "1.0",
  "proposal_id": "mapping-crm-cif",
  "tenant_id": "demo-bank",
  "kind": "mapping",
  "risk": "medium",
  "source_snapshot_ids": [
    "crm-parties@sha256:503d103ab015d2fb7720ba7e4aeed7f54e999426e22bc6e126fd663b79f5146a"
  ],
  "active_ontology_version": "2026.07.1",
  "source_locator": "data/synthetic/crm_parties.csv#field=cif_no",
  "target_iri": "urn:ontology-appliance:vocab:CustomerIdentifier",
  "transformation": "identity(source_value); scope=CRM; do_not_infer_global_uniqueness",
  "evidence": [
    {
      "evidence_id": "evidence-crm-schema-cif",
      "tenant_id": "demo-bank",
      "source_id": "crm-parties",
      "snapshot_id": "crm-parties@sha256:503d103ab015d2fb7720ba7e4aeed7f54e999426e22bc6e126fd663b79f5146a",
      "locator": "contracts/crm.schema.json#/properties/cif_no",
      "observed_at": "2026-07-22T13:51:12Z",
      "extractor_version": "1.0.0",
      "content_sha256": "1e06c3c81dc5f2c2d60ad063ff54428aaf3620d6d15e5ac3c4c3e26f826599cd"
    },
    {
      "evidence_id": "evidence-crm-profile-cif",
      "tenant_id": "demo-bank",
      "source_id": "crm-parties",
      "snapshot_id": "crm-parties@sha256:503d103ab015d2fb7720ba7e4aeed7f54e999426e22bc6e126fd663b79f5146a",
      "locator": "profiles/crm/cif_no.json#/statistics",
      "observed_at": "2026-07-22T13:51:12Z",
      "extractor_version": "1.0.0",
      "content_sha256": "4b361852e6ee0f9719317b0999022a31a52fa92bb1d31e44ae3d1569523896e3"
    }
  ],
  "counterevidence": [
    {
      "evidence_id": "evidence-crm-cif-duplicate-0042",
      "tenant_id": "demo-bank",
      "source_id": "crm-parties",
      "snapshot_id": "crm-parties@sha256:503d103ab015d2fb7720ba7e4aeed7f54e999426e22bc6e126fd663b79f5146a",
      "locator": "data/synthetic/crm_parties.csv#row=6:field=cif_no,row=7:field=cif_no",
      "observed_at": "2026-07-22T13:51:12Z",
      "extractor_version": "1.0.0",
      "content_sha256": "503d103ab015d2fb7720ba7e4aeed7f54e999426e22bc6e126fd663b79f5146a",
      "claim": "CIF-0042 is reused by two historical merged party records."
    }
  ],
  "confidence": {
    "lexical": 0.96,
    "structural": 0.92,
    "instance": 0.88,
    "external": 0.0,
    "model": 0.0,
    "evidence_coverage": 1.0
  },
  "generator": {
    "mode": "deterministic",
    "model_participated": false,
    "provider": "ontology-appliance",
    "model": "schema-profile-rules-v1",
    "provider_returned_model_id": null,
    "prompt_version": "not-applicable",
    "parameters": {},
    "token_usage": null,
    "latency_ms": 0,
    "response_status": "not_invoked"
  },
  "algorithm_version": "mapping-cif-rules-v1",
  "deterministic_input": {
    "tenantId": "demo-bank",
    "sourceSnapshotIds": [
      "crm-parties@sha256:503d103ab015d2fb7720ba7e4aeed7f54e999426e22bc6e126fd663b79f5146a"
    ],
    "ontologyVersion": "2026.07.1",
    "targetIri": "urn:ontology-appliance:vocab:CustomerIdentifier",
    "algorithmVersion": "mapping-cif-rules-v1",
    "evidenceContentSha256": [
      "1e06c3c81dc5f2c2d60ad063ff54428aaf3620d6d15e5ac3c4c3e26f826599cd",
      "4b361852e6ee0f9719317b0999022a31a52fa92bb1d31e44ae3d1569523896e3",
      "503d103ab015d2fb7720ba7e4aeed7f54e999426e22bc6e126fd663b79f5146a"
    ]
  },
  "deterministic_input_hash": "fe6cd5cf3826a67e8bd3c216c888febbd55697b7c2b638aa381bcb389bcf985d",
  "status": "PENDING_VERIFICATION",
  "reason_codes": [
    "READY_FOR_INDEPENDENT_VERIFICATION"
  ]
}
